{
  "schemaVersion": 1,
  "checkpoint_id": "c_2",
  "run_id": "run_01J8Z3K5QW7XV2M9N4P6R8T0AB",
  "parent_checkpoint_id": "c_1",
  "label": "before-refactor",
  "state_blob": {
    "sha256": "cd19da5994224141801f277fdfc08871c5d7fdcece49962f9a4b99683b96af10",
    "size": 482
  },
  "state_hash": "cd19da5994224141801f277fdfc08871c5d7fdcece49962f9a4b99683b96af10",
  "workspace_commit": "87b805cfcd7f422dc6c23c57179d7c0929d3147d",
  "ledger_seq": 9,
  "usage": {
    "input_tokens": 18234,
    "output_tokens": 2210
  },
  "created_at": "2026-09-13T12:03:12.500Z"
}
